### ISSUE TITLE
Containers cannot communicate across hosts

### ISSUE THREAD

**Issue by hectorj2f** [projectcalico/calico-containers#1071]
Hello there, I have a virtualized environment on which I run kubernetes nodes (a master and two workers) that use calico cni for networking. The kube nodes run in a flannel network so I have a flannel interface, and the nodes are containers inside the flannel ip range. 

I am using CoreOS, kubernetes `v1.3.0_coreos.1` docker images with the `cni` network plugin and the `k8s-proxy` in an iptable mode.

In one of my hosts:
```
$ ifconfig
br 10.2.58.1 ## (used to allocate ips to the kube nodes via dhcp)
flannel.X 10.2.58.0
```

When I start the cluster I define it like that:

```
$calicoctl pool add 192.168.0.0/16 --ipip
$ calicoctl node --ip=${DEFAULT_IPV4}  --detach=false --node-image=calico/node:v0.20.0
$ /opt/bin/calicoctl bgp peer add FLANNEL.X_IP as default_as_number
```

My calico configuration for k8s looks like:

```
    {
        "name": "calico-k8s-network",
        "type": "calico",
        "etcd_authority": "HOST_PUBLIC_IP:2379",
        "log_level": "info",
        "ipam": {
            "type": "calico-ipam"
        },
        "policy": {
            "type": "k8s",
            "k8s_api_root": "http://MASTER_ENDPOINT/api/v1/"
        }
    }
```

The status of calico in (kube-node-1):
```
 $ sudo ETCD_AUTHORITY=172.17.8.102:2379 calicoctl status
calico-node container is running. Status: Up 55 minutes
Running felix version 1.4.0rc2

IPv4 BGP status
IP: 10.2.58.2    AS Number: 64511 (inherited)
+--------------+-------------------+-------+----------+-------------------------------------------+
| Peer address |     Peer type     | State |  Since   |                    Info                   |
+--------------+-------------------+-------+----------+-------------------------------------------+
|  10.2.70.2   | node-to-node mesh |   up  | 10:36:34 |                Established                |
|  10.2.15.2   | node-to-node mesh |   up  | 10:36:33 |                Established                |
|  10.2.58.0   |       global      | start | 10:36:31 | Active        Socket: Network unreachable |
|  10.2.70.0   |       global      |   up  | 10:36:39 |                Established                |
|  10.2.15.0   |       global      |   up  | 10:36:46 |                Established                |
+--------------+-------------------+-------+----------+-------------------------------------------+

IPv6 BGP status
No IPv6 address configured.
```

And the routing table of `10.2.58.2`  in (kube-node-1):
```
$ route -n
Kernel IP routing table
Destination     Gateway         Genmask         Flags Metric Ref    Use Iface
0.0.0.0         10.2.58.1       0.0.0.0         UG    1024   0        0 eth0
10.2.58.0       10.2.58.1       255.255.255.255 UGH   0      0        0 eth0
10.2.58.0       0.0.0.0         255.255.255.0   U     0      0        0 eth0
10.2.58.1       0.0.0.0         255.255.255.255 UH    1024   0        0 eth0
172.17.8.102    10.2.58.1       255.255.255.255 UGH   0      0        0 eth0
172.18.0.0      0.0.0.0         255.255.0.0     U     0      0        0 docker0
192.168.102.128 10.2.70.2       255.255.255.192 UG    0      0        0 tunl0
192.168.123.192 10.2.15.2       255.255.255.192 UG    0      0        0 tunl0
192.168.205.128 0.0.0.0         255.255.255.192 U     0      0        0 *
192.168.205.129 0.0.0.0         255.255.255.255 UH    0      0        0 cali19eaad3c4cd
192.168.205.130 0.0.0.0         255.255.255.255 UH    0      0        0 cali1a8df4244cd
192.168.205.131 0.0.0.0         255.255.255.255 UH    0      0        0 cali1b5632ae4cd
192.168.205.132 0.0.0.0         255.255.255.255 UH    0      0        0 cali83ded51e4cd
192.168.205.133 0.0.0.0         255.255.255.255 UH    0      0        0 cali83f3023c4cd
```

In another  kube node (kube-node-2) of my cluster:

```
 $ route -n
Kernel IP routing table
Destination     Gateway         Genmask         Flags Metric Ref    Use Iface
0.0.0.0         10.2.15.1       0.0.0.0         UG    1024   0        0 eth0
10.2.15.0       0.0.0.0         255.255.255.0   U     0      0        0 eth0
10.2.15.1       0.0.0.0         255.255.255.255 UH    1024   0        0 eth0
172.17.8.101    10.2.15.1       255.255.255.255 UGH   0      0        0 eth0
172.18.0.0      0.0.0.0         255.255.0.0     U     0      0        0 docker0
192.168.102.128 10.2.70.2       255.255.255.192 UG    0      0        0 tunl0
192.168.123.192 0.0.0.0         255.255.255.192 U     0      0        0 *
192.168.123.193 0.0.0.0         255.255.255.255 UH    0      0        0 cali84bd58664cd
192.168.123.194 0.0.0.0         255.255.255.255 UH    0      0        0 cali8578b5d44cd
192.168.123.195 0.0.0.0         255.255.255.255 UH    0      0        0 cali8654de2e4cd
192.168.123.196 0.0.0.0         255.255.255.255 UH    0      0        0 cali86f30e644cd
192.168.205.128 10.2.58.2       255.255.255.192 UG    0      0        0 tunl0
```

The status of calico in (kube-node-2):
```
 $ sudo ETCD_AUTHORITY=172.17.8.101:2379 calicoctl status
calico-node container is running. Status: Up About an hour
Running felix version 1.4.0rc2

IPv4 BGP status
IP: 10.2.15.2    AS Number: 64511 (inherited)
+--------------+-------------------+-------+----------+-------------------------------------------+
| Peer address |     Peer type     | State |  Since   |                    Info                   |
+--------------+-------------------+-------+----------+-------------------------------------------+
|  10.2.58.2   | node-to-node mesh |   up  | 10:36:46 |                Established                |
|  10.2.70.2   | node-to-node mesh |   up  | 10:36:46 |                Established                |
|  10.2.58.0   |       global      |   up  | 10:36:33 |                Established                |
|  10.2.70.0   |       global      |   up  | 10:36:38 |                Established                |
|  10.2.15.0   |       global      | start | 10:36:44 | Active        Socket: Network unreachable |
+--------------+-------------------+-------+----------+-------------------------------------------+

IPv6 BGP status
No IPv6 address configured.
````

When I try to ping any container from a different host (kube-node-1): 

`$ ping 192.168.205.132` it fails :/ 

Could this happen due to the problem to connect to `10.2.15.0` which is the IP of the FLannel.X interface.

In (kube-node-2) tcpdump tells me that requests are reaching the destination:

```
$ tcpdump | grep 205.132
14:31:43.368305 IP 10.2.15.2 > 10.2.58.2: IP 192.168.123.192 > 192.168.205.132: ICMP echo request, id 23895, seq 1121, length 64 (ipip-proto-4)
14:31:44.369105 IP 10.2.15.2 > 10.2.58.2: IP 192.168.123.192 > 192.168.205.132: ICMP echo request, id 23895, seq 1122, length 64 (ipip-proto-4)
14:31:45.370737 IP 10.2.15.2 > 10.2.58.2: IP 192.168.123.192 > 192.168.205.132: ICMP echo request, id 23895, seq 1123, length 64 (ipip-proto-4)
14:31:46.371913 IP 10.2.15.2 > 10.2.58.2: IP 192.168.123.192 > 192.168.205.132: ICMP echo request, id 23895, seq 1124, length 64 (ipip-proto-4)
14:31:47.374121 IP 10.2.15.2 > 10.2.58.2: IP 192.168.123.192 > 192.168.205.132: ICMP echo request, id 23895, seq 1125, length 64 (ipip-proto-4)
```

In (kube-node-1)
```
$ tcpdump -i tunl0 | grep 205.132
14:38:54.511629 IP 192.168.123.192 > 192.168.205.132: ICMP echo request, id 23895, seq 1552, length 64
14:38:55.512235 IP 192.168.123.192 > 192.168.205.132: ICMP echo request, id 23895, seq 1553, length 64
14:38:56.514251 IP 192.168.123.192 > 192.168.205.132: ICMP echo request, id 23895, seq 1554, length 64
```

**Comment by matthewdupre** [comment]
Looking at the tcpdumps at the end, there's no return packets visible at all.  Could you please confirm that by tcpdumping the caliX interface into the destination container?  Usually with problems of this form I'd expect to see return packets on the destination host, but them not going over tunl0 and therefore dropped by the switch.

If there aren't any return packets, could you please grab `iptables -L -v -n` from the destination host.

**Comment by hectorj2f** [comment]
@matthewdupre Thanks for your reply. I just double checked and I don't get anything in ` tcpdump -i tunl0` nor ` tcpdump -i caliX` in the destination host `kube-node-2` :-/ . I can only see the incoming requests in `tcpdump -i eth0` in the destination host.

In the destination host `kube-node-2`, I show the output of `iptables -L -v -n` in the following gist: https://gist.github.com/hectorj2f/177a2d48cc0fc172cc5cd420d3b138b7

Note: I had to bootstrap a new cluster. But the configuration is the same, `caliX` and some ips might slightly differ.

**Comment by matthewdupre** [comment]
So no incoming packets on caliX either?

**Comment by matthewdupre** [comment]
So packets getting to the host, but not the container suggests iptables is blocking them, or a routing failure, but the tables look good above.

I note that there are some drops in the first entry in felix-FORWARD.  Could you send me `ipset list felix-calico-hosts-4` please?

**Comment by hectorj2f** [comment]
I don't get incoming packets in caliX from the host of origin.

When I try the command you suggested to me, I get the following error:
```
$ sudo ipset list felix-calico-hosts-4
ipset v6.20.1: Kernel and userspace incompatible: settype by userspace. with revision 3173815632 not supported
```

**Comment by hectorj2f** [comment]
@matthewdupre I manage to see incoming requests, if I open the iptables. However the calico iptable rules seem to be restored after few seconds.

```
tcpdump -i calib86ae39e4db
tcpdump: verbose output suppressed, use -v or -vv for full protocol decode
listening on calib86ae39e4db, link-type EN10MB (Ethernet), capture size 262144 bytes
14:56:50.252820 IP 192.168.209.0 > 192.168.141.73: ICMP echo request, id 21766, seq 10, length 64
14:56:50.254522 IP 192.168.141.73 > 192.168.209.0: ICMP echo reply, id 21766, seq 10, length 64
14:56:50.865796 IP 192.168.209.0 > 192.168.141.73: ICMP echo request, id 21766, seq 11, length 64
14:56:50.867101 IP 192.168.141.73 > 192.168.209.0: ICMP echo reply, id 21766, seq 11, length 64
14:56:51.858041 IP 192.168.209.0 > 192.168.141.73: ICMP echo request, id 21766, seq 12, length 64
14:56:51.858562 IP 192.168.141.73 > 192.168.209.0: ICMP echo reply, id 21766, seq 12, length 64
14:56:52.880374 IP 192.168.209.0 > 192.168.141.73: ICMP echo request, id 21766, seq 13, length 64
14:56:52.881970 IP 192.168.141.73 > 192.168.209.0: ICMP echo reply, id 21766, seq 13, length 64
```

**Comment by matthewdupre** [comment]
Looks like the traffic is originating from outside felix-calico-hosts-4.

**Comment by matthewdupre** [comment]
The IPIP packets are probably being dropped because they aren't coming from a known IPIP source.

If you figure out what the source address is, you could add a bird_ip entry to etcd to imitate that being a Calico host: e.g. `etcdctl set /calico/v1/host/fakehost1/bird_ip <IP>`.  We should still figure out what about your setup it is that's making the packets come from an unexpected source.

**Comment by hectorj2f** [comment]
@matthewdupre I saw this too.. If I add the hosts as recognized bird IPs, it works.

Nevertheless I tried to use IPIP but without success. I prompt the output of the commands:

```
$ sudo ETCD_AUTHORITY=172.17.8.101:2379 calicoctl status
calico-node container is running. Status: Up 5 minutes
Running felix version 1.4.0rc2

IPv4 BGP status
IP: 10.1.56.2 AS Number: 64511 (inherited)
+--------------+-------------------+-------+----------+------------------------------------------------+
| Peer address | Peer type | State | Since | Info |
+--------------+-------------------+-------+----------+------------------------------------------------+
| 10.1.92.2 | node-to-node mesh | start | 10:17:03 | Active Socket: Connection reset by peer |
| 10.1.89.2 | node-to-node mesh | start | 10:17:03 | Active Socket: Connection reset by peer |
+--------------+-------------------+-------+----------+------------------------------------------------+

IPv6 BGP status
No IPv6 address configured.
```

Logs from `/var/log/calico/bird/current`

```
2016-07-20_10:32:02.21977 bird: Reconfiguration requested by SIGHUP
2016-07-20_10:32:02.21978 bird: Reconfiguring
2016-07-20_10:32:02.21979 bird: device1: Reconfigured
2016-07-20_10:32:02.21980 bird: direct1: Reconfigured
2016-07-20_10:32:02.21980 bird: Mesh_10_1_92_2: Reconfigured
2016-07-20_10:32:02.21980 bird: Mesh_10_1_89_2: Reconfigured
2016-07-20_10:32:02.21980 bird: Reconfigured
2016-07-20_10:32:03.35999 bird: BGP: Unexpected connect from unknown address 10.1.89.0 (port 38009)
2016-07-20_10:32:04.36093 bird: BGP: Unexpected connect from unknown address 10.1.92.0 (port 37117)
2016-07-20_10:32:04.36095 bird: device1: Scanning interfaces
2016-07-20_10:32:04.36095 bird: Mesh_10_1_92_2: Connecting to 10.1.92.2 from local address 10.1.56.2
2016-07-20_10:32:04.36181 bird: Mesh_10_1_92_2: Connected
2016-07-20_10:32:04.36183 bird: Mesh_10_1_92_2: Sending OPEN(ver=4,as=64511,hold=240,id=0a013802)
2016-07-20_10:32:04.36253 bird: Mesh_10_1_92_2: Connection closed
2016-07-20_10:32:04.36259 bird: Mesh_10_1_92_2: Connect delayed by 5 seconds
2016-07-20_10:32:05.36403 bird: Mesh_10_1_89_2: Connecting to 10.1.89.2 from local address 10.1.56.2
2016-07-20_10:32:05.36608 bird: Mesh_10_1_89_2: Connected
2016-07-20_10:32:05.36610 bird: Mesh_10_1_89_2: Sending OPEN(ver=4,as=64511,hold=240,id=0a013802)
2016-07-20_10:32:05.36774 bird: Mesh_10_1_89_2: Connection lost (Connection reset by peer)
2016-07-20_10:32:05.36789 bird: Mesh_10_1_89_2: Connect delayed by 5 seconds
2016-07-20_10:32:06.36917 bird: device1: Scanning interfaces
2016-07-20_10:32:07.37427 bird: BGP: Unexpected connect from unknown address 10.1.89.0 (port 53619)
2016-07-20_10:32:08.37726 bird: device1: Scanning interfaces
2016-07-20_10:32:08.37727 bird: Mesh_10_1_92_2: Connecting to 10.1.92.2 from local address 10.1.56.2
2016-07-20_10:32:08.37992 bird: Mesh_10_1_92_2: Connected
2016-07-20_10:32:08.37993 bird: Mesh_10_1_92_2: Sending OPEN(ver=4,as=64511,hold=240,id=0a013802)
2016-07-20_10:32:08.38077 bird: BGP: Unexpected connect from unknown address 10.1.92.0 (port 59412)
2016-07-20_10:32:08.38080 bird: Mesh_10_1_92_2: Connection closed
2016-07-20_10:32:08.38081 bird: Mesh_10_1_92_2: Connect delayed by 5 seconds
2016-07-20_10:32:09.38285 bird: Mesh_10_1_89_2: Connecting to 10.1.89.2 from local address 10.1.56.2
2016-07-20_10:32:09.38442 bird: Mesh_10_1_89_2: Connected
2016-07-20_10:32:09.38445 bird: Mesh_10_1_89_2: Sending OPEN(ver=4,as=64511,hold=240,id=0a013802)
2016-07-20_10:32:09.38614 bird: Mesh_10_1_89_2: Connection lost (Connection reset by peer)
2016-07-20_10:32:09.38617 bird: Mesh_10_1_89_2: Connect delayed by 5 seconds
2016-07-20_10:32:10.38635 bird: device1: Scanning interfaces
2016-07-20_10:32:12.38813 bird: device1: Scanning interfaces
2016-07-20_10:32:12.39909 bird: BGP: Unexpected connect from unknown address 10.1.89.0 (port 37065)
2016-07-20_10:32:13.40117 bird: Mesh_10_1_92_2: Connecting to 10.1.92.2 from local address 10.1.56.2
2016-07-20_10:32:13.40207 bird: BGP: Unexpected connect from unknown address 10.1.92.0 (port 60639)
2016-07-20_10:32:13.40508 bird: Mesh_10_1_92_2: Connected
2016-07-20_10:32:13.40509 bird: Mesh_10_1_92_2: Sending OPEN(ver=4,as=64511,hold=240,id=0a013802)
2016-07-20_10:32:13.40674 bird: Mesh_10_1_92_2: Connection closed
2016-07-20_10:32:13.40675 bird: Mesh_10_1_92_2: Connect delayed by 5 seconds
2016-07-20_10:32:14.40887 bird: Mesh_10_1_89_2: Connecting to 10.1.89.2 from local address 10.1.56.2
```


Tcp dump in the destination host:

```
$  tcpdump -i eth0 | grep 10.1.56.

10:50:48.747969 IP 10.1.92.2.44896 > 10.1.56.2.bgp: Flags [S], seq 338078018, win 29200, options [mss 1460,sackOK,TS val 1816008 ecr 0,nop,wscale 6], length 0
10:50:48.749009 IP 10.1.56.2.bgp > 10.1.92.2.44896: Flags [S.], seq 3377111042, ack 338078019, win 28960, options [mss 1460,sackOK,TS val 1816350 ecr 1816008,nop,wscale 6], length 0
10:50:48.749056 IP 10.1.92.2.44896 > 10.1.56.2.bgp: Flags [.], ack 1, win 457, options [nop,nop,TS val 1816009 ecr 1816350], length 0
10:50:48.749187 IP 10.1.92.2.44896 > 10.1.56.2.bgp: Flags [P.], seq 1:62, ack 1, win 457, options [nop,nop,TS val 1816009 ecr 1816350], length 61: BGP
10:50:48.749766 IP 10.1.56.2.bgp > 10.1.92.2.44896: Flags [.], ack 62, win 453, options [nop,nop,TS val 1816351 ecr 1816009], length 0
10:50:48.750016 IP 10.1.56.2.bgp > 10.1.92.2.44896: Flags [R.], seq 1, ack 62, win 453, options [nop,nop,TS val 1816352 ecr 1816009], length 0
10:50:52.762264 IP 10.1.56.0.47432 > 10.1.92.2.bgp: Flags [S], seq 263626678, win 29200, options [mss 1460,sackOK,TS val 1820364 ecr 0,nop,wscale 6], length 0
10:50:52.762364 IP 10.1.92.2.bgp > 10.1.56.0.47432: Flags [S.], seq 3250876126, ack 263626679, win 28960, options [mss 1460,sackOK,TS val 1820022 ecr 1820364,nop,wscale 6], length 0
10:50:52.763519 IP 10.1.56.0.47432 > 10.1.92.2.bgp: Flags [.], ack 1, win 457, options [nop,nop,TS val 1820365 ecr 1820022], length 0
10:50:52.763622 IP 10.1.56.0.47432 > 10.1.92.2.bgp: Flags [P.], seq 1:62, ack 1, win 457, options [nop,nop,TS val 1820366 ecr 1820022], length 61: BGP
10:50:52.763653 IP 10.1.92.2.bgp > 10.1.56.0.47432: Flags [.], ack 62, win 453, options [nop,nop,TS val 1820024 ecr 1820366], length 0
10:50:52.763909 IP 10.1.92.2.bgp > 10.1.56.0.47432: Flags [R.], seq 1, ack 62, win 453, options [nop,nop,TS val 1820024 ecr 1820366], length 0
10:50:53.765689 IP 10.1.92.2.33839 > 10.1.56.2.bgp: Flags [S], seq 1021450681, win 29200, options [mss 1460,sackOK,TS val 1821026 ecr 0,nop,wscale 6], length 0
10:50:53.766772 IP 10.1.56.2.bgp > 10.1.92.2.33839: Flags [S.], seq 1199697462, ack 1021450682, win 28960, options [mss 1460,sackOK,TS val 1821369 ecr 1821026,nop,wscale 6], length 0
10:50:53.766835 IP 10.1.92.2.33839 > 10.1.56.2.bgp: Flags [.], ack 1, win 457, options [nop,nop,TS val 1821027 ecr 1821369], length 0
10:50:53.766910 IP 10.1.92.2.33839 > 10.1.56.2.bgp: Flags [P.], seq 1:62, ack 1, win 457, options [nop,nop,TS val 1821027 ecr 1821369], length 61: BGP
10:50:53.768826 IP 10.1.56.2.bgp > 10.1.92.2.33839: Flags [.], ack 62, win 453, options [nop,nop,TS val 1821370 ecr 1821027], length 0
10:50:53.768859 IP 10.1.56.2.bgp > 10.1.92.2.33839: Flags [R.], seq 1, ack 62, win 453, options [nop,nop,TS val 1821370 ecr 1821027], length 0
10:50:56.776112 IP 10.1.56.0.42266 > 10.1.92.2.bgp: Flags [S], seq 593481018, win 29200, options [mss 1460,sackOK,TS val 1824378 ecr 0,nop,wscale 6], length 0
10:50:56.776758 IP 10.1.92.2.bgp > 10.1.56.0.42266: Flags [S.], seq 2869497388, ack 593481019, win 28960, options [mss 1460,sackOK,TS val 1824037 ecr 1824378,nop,wscale 6], length 0
10:50:56.780504 IP 10.1.56.0.42266 > 10.1.92.2.bgp: Flags [.], ack 1, win 457, options [nop,nop,TS val 1824380 ecr 1824037], length 0
10:50:56.782877 IP 10.1.56.0.42266 > 10.1.92.2.bgp: Flags [P.], seq 1:62, ack 1, win 457, options [nop,nop,TS val 1824380 ecr 1824037], length 61: BGP
```

If I block the tips of 10.1.56.0, 10.1.89.0 … sudo iptables -I FORWARD -s 10.1.56.0 -d 10.1.92.2 -j DROP … then I cannot ping the hosts between themselves.

```
11:07:00.371687 IP 10.1.92.1.57704 > 10.1.92.2.ssh: Flags [.], ack 147820, win 1384, options [nop,nop,TS val 3529606 ecr 2787631], length 0
11:07:00.372466 IP 10.1.92.2.ssh > 10.1.92.1.57704: Flags [P.], seq 147820:148048, ack 73, win 556, options [nop,nop,TS val 2787632 ecr 3529606], length 228
11:07:00.372990 IP 10.1.92.2.ssh > 10.1.92.1.57704: Flags [P.], seq 148048:148260, ack 73, win 556, options [nop,nop,TS val 2787633 ecr 3529606], length 212
11:07:00.373245 IP 10.1.92.1.57704 > 10.1.92.2.ssh: Flags [.], ack 148260, win 1384, options [nop,nop,TS val 3529607 ecr 2787632], length 0
11:07:00.373745 IP 10.1.92.2.ssh > 10.1.92.1.57704: Flags [P.], seq 148260:148488, ack 73, win 556, options [nop,nop,TS va
```

**Comment by matthewdupre** [comment]
@hectorj2f I need to understand exactly where all the IP addresses sit (notice that BIRD is complaining about incoming connections from unexpected addresses, and unsurprisingly its own outgoing connections are also failing).

Specifically things like on which interfaces, inside which VMs / containers: `ip addr list` and `ip route` from each entity (VM, container etc) with an indication of the hierarchy (this container is inside this VM ...) should do it.

Thanks,
Matt

**Comment by hectorj2f** [comment]
@matthewdupre Okay, I'd facilitate you this data within this week. Thanks

**Comment by hectorj2f** [comment]
@matthewdupre We're able to communicate  the containers between VMs once we add the bridge IP of our VMs to the `bird_ip` of calico. 

Would it be this error prone ? 
Is there a way to specify a IP range of trusted IPs instead of specific IPs ?

**Comment by hectorj2f** [comment]
> @hectorj2f I need to understand exactly where all the IP addresses sit (notice that BIRD is complaining about incoming connections from unexpected addresses, and unsurprisingly its own outgoing connections are also failing).

I share with you a picture of how our networking stack looks like. I hope it helps you to understand our infra.
![copy of copy of multi-tenant-network](https://cloud.githubusercontent.com/assets/3602792/17480483/649e1872-5d78-11e6-8845-517724153c32.png)

**Comment by hectorj2f** [comment]
@matthewdupre We can close this issue as we overcome the mentioned problems. Thx @matthewdupre

**Comment by panxia6679** [comment]
@hectorj2f, would you please tell us the solution you applied? Thanks.

I got the similar problem in my cluster with the same log in calico-node pod container.

~~~
bird: Mesh_10_254_77_1: Connecting to 10.254.77.1 from local address 10.40.0.0
bird: Mesh_10_254_77_1: Connected
bird: BGP: Unexpected connect from unknown address 10.40.0.0 (port 39193)
bird: Mesh_10_254_77_1: Sending OPEN(ver=4,as=64511,hold=240,id=0a280000)
bird: Mesh_10_254_77_1: Connection closed
bird: Mesh_10_254_77_1: Connect delayed by 5 seconds
~~~
