### ISSUE TITLE
Container is unreachable from host

### ISSUE THREAD

**Issue by depay** [projectcalico/calico-containers#987]
i deployed calico in our bare metal CentOS 7 cluster

```
calicoctl version 0.18.0
calico/node:v0.18.0
calico/node-libnetwork:v0.8.0
```

and create network with libnetwork

```
docker network create --driver calico --subnet=192.168.1.0/24 net1
```

ip of host is 10.15.230.1/21, ip of container is 192.168.1.1/24.

container to container in the same network is reachable, no matter in the same host or not.

but container is unreachable from host, even i make its profile like

```
  "inbound_rules": [
    {
      "action": "allow"
    }
  ],
```

and i run tcpdump when ping container ip from host, it showing:

```
tcpdump: WARNING: cali3a577b41820: no IPv4 address assigned
tcpdump: verbose output suppressed, use -v or -vv for full protocol decode
listening on cali3a577b41820, link-type EN10MB (Ethernet), capture size 65535 bytes
15:27:03.908185 IP xxxxxxx > 192.168.1.1: ICMP echo request, id 24478, seq 1, length 64
15:27:04.908361 IP xxxxxxx > 192.168.1.1: ICMP echo request, id 24478, seq 2, length 64
15:27:05.908365 IP xxxxxxx > 192.168.1.1: ICMP echo request, id 24478, seq 3, length 64
...
```

Is that a right result ? If yes, is it the result of iptables rules by felix ?

**Comment by fasaxc** [comment]
@depay thanks for the report.  Please can you give the commands that you used to update the profile?  How did you find the right profile and what does the whole profile look like?

**Comment by depay** [comment]
@fasaxc thanks for ur reply..

command i used to update profile is

```
calicoctl profile net1 rule add inbound allow
```

before

```
{
  "id": "net1", 
  "inbound_rules": [
    {
      "action": "allow", 
      "src_tag": "net1"
    }
  ], 
  "outbound_rules": [
    {
      "action": "allow"
    }
  ]
}
```

after

```
{
  "id": "net1", 
  "inbound_rules": [
    {
      "action": "allow", 
      "src_tag": "net1"
    }, 
    {
      "action": "allow"
    }
  ], 
  "outbound_rules": [
    {
      "action": "allow"
    }
  ]
}
```

but it did not work, still unreachable from neither host nor container in other network.

**Comment by fasaxc** [comment]
But is the profile for your network called "net1"?  I thought that our profile names were the UUID of the network.

Please can you use etcdctl to get one of the endpoints, we need to see the `profile_ids` field.  The endpoints should be under `/calico/v1/host/<hostname>/workload/...`

**Comment by depay** [comment]
UUID and network_name are the same when using libnetwork, as

```
{
  "id": "327f3bb5af73a081730ebefe14132916b8186567cfee61ad1104dc5455312dd6", 
  "inbound_rules": [
    {
      "action": "allow",
      "src_tag": "327f3bb5af73a081730ebefe14132916b8186567cfee61ad1104dc5455312dd6"
    },
    {
      "action": "allow"
    }
  ],
  "outbound_rules": [
    {
      "action": "allow"
    }
  ]
}
```

one endpoint in etcd is

```
{
"ipv6_gateway": null,
"state": "active",
"name": "calib9867360495",
"ipv4_gateway": "192.168.1.1",
"ipv6_nets": [],
"profile_ids": ["327f3bb5af73a081730ebefe14132916b8186567cfee61ad1104dc5455312dd6"],
"mac": "EE:EE:EE:EE:EE:EE",
"ipv4_nets": ["192.168.1.2/24"]
}
```

**Comment by depay** [comment]
some iptables rules are

```
Chain felix-from-xxxxxxxx (1 references)
num  target     prot opt source               destination
1    MARK       all  --  anywhere             anywhere             MARK and 0xfeffffff
2    DROP       all  --  anywhere             anywhere             MAC ! EE:EE:EE:EE:EE:EE /* Incorrect source MAC */
3    felix-p-_12aa1ed55348f0d-o  all  --  anywhere             anywhere
4    RETURN     all  --  anywhere             anywhere             mark match 0x1000000/0x1000000 /* Profile accepted packet */
5    DROP       all  --  anywhere             anywhere             /* Packet did not match any profile (endpoint ef1042c449b107ea0fdbc4f78f1bc4d5d2238d37ab58544d93f2ea95026a57e6) */
```

i'm wondering whether rule 2 `DROP       all  --  anywhere             anywhere             MAC ! EE:EE:EE:EE:EE:EE /* Incorrect source MAC */` drop the packets from host ip/mac ?

**Comment by fasaxc** [comment]
@depay what's in the `felix-p-_12aa1ed55348f0d-i/o` chains?  those are the chains that map to the inbound and outbound rules.

The `felix-from-xxx` chain is used for outgoing traffic from the endpoint.  We explicitly set the MAC address of the eth to ee:ee:ee:ee:ee:ee so that should be correct.

**Comment by depay** [comment]
```
Chain felix-from-bcabb2c27b0 (1 references)
num  target     prot opt source               destination         
1    MARK       all  --  anywhere             anywhere             MARK and 0xfeffffff
2    DROP       all  --  anywhere             anywhere             MAC ! EE:EE:EE:EE:EE:EE /* Incorrect source MAC */
3    felix-p-_12aa1ed55348f0d-o  all  --  anywhere             anywhere            
4    RETURN     all  --  anywhere             anywhere             mark match 0x1000000/0x1000000 /* Profile accepted packet */
5    DROP       all  --  anywhere             anywhere             /* Packet did not match any profile (endpoint bcabb2c27b0b3b3ede6e6efc4ef1f2b708b9db431c803e244e3b8cc54151e5f3) */

Chain felix-p-_12aa1ed55348f0d-i (1 references)
num  target     prot opt source               destination         
1    MARK       all  --  anywhere             anywhere             MARK or 0x1000000
2    RETURN     all  --  anywhere             anywhere             match-set felix-v4-_12aa1ed55348f0d src
3    RETURN     all  --  anywhere             anywhere            
4    MARK       all  --  anywhere             anywhere             /* No match, fall through to next profile */ MARK and 0xfeffffff

Chain felix-p-_12aa1ed55348f0d-o (1 references)
num  target     prot opt source               destination         
1    MARK       all  --  anywhere             anywhere             MARK or 0x1000000
2    RETURN     all  --  anywhere             anywhere            
3    MARK       all  --  anywhere             anywhere             /* No match, fall through to next profile */ MARK and 0xfeffffff

Chain felix-to-bcabb2c27b0 (1 references)
num  target     prot opt source               destination         
1    MARK       all  --  anywhere             anywhere             MARK and 0xfeffffff
2    felix-p-_12aa1ed55348f0d-i  all  --  anywhere             anywhere            
3    RETURN     all  --  anywhere             anywhere             mark match 0x1000000/0x1000000 /* Profile accepted packet */
4    DROP       all  --  anywhere             anywhere             /* Packet did not match any profile (endpoint bcabb2c27b0b3b3ede6e6efc4ef1f2b708b9db431c803e244e3b8cc54151e5f3) */
```

rule 3 in `Chain felix-p-_12aa1ed55348f0d-i` may be what we want

**Comment by fasaxc** [comment]
Hmm, those chains look correct (and match the allow rule you added).

The fact that you see the pings going into the calixxx device means that they must have passed the iptables rules on the way into the container.  Are you able to run commands inside the container?  What does `ip route show`, `ip addr show` and `ip link show` give you inside the container?

**Comment by depay** [comment]
```
[root@c151e2c627bc /]# ip route show
default via 172.18.0.1 dev eth1 
172.18.0.0/16 dev eth1  proto kernel  scope link  src 172.18.0.3 
192.168.2.0/24 dev cali0  proto kernel  scope link  src 192.168.2.3
```
```
[root@c151e2c627bc /]# ip addr show 
1: lo: <LOOPBACK,UP,LOWER_UP> mtu 65536 qdisc noqueue state UNKNOWN 
    link/loopback 00:00:00:00:00:00 brd 00:00:00:00:00:00
    inet 127.0.0.1/8 scope host lo
       valid_lft forever preferred_lft forever
    inet6 ::1/128 scope host 
       valid_lft forever preferred_lft forever
9929: cali0@if9930: <BROADCAST,MULTICAST,UP,LOWER_UP> mtu 1500 qdisc pfifo_fast state UP qlen 1000
    link/ether ee:ee:ee:ee:ee:ee brd ff:ff:ff:ff:ff:ff link-netnsid 0
    inet 192.168.2.3/24 scope global cali0
       valid_lft forever preferred_lft forever
    inet6 fe80::ecee:eeff:feee:eeee/64 scope link 
       valid_lft forever preferred_lft forever
9931: eth1@if9932: <BROADCAST,MULTICAST,UP,LOWER_UP> mtu 1500 qdisc noqueue state UP 
    link/ether 02:42:ac:12:00:03 brd ff:ff:ff:ff:ff:ff link-netnsid 0
    inet 172.18.0.3/16 scope global eth1
       valid_lft forever preferred_lft forever
    inet6 fe80::42:acff:fe12:3/64 scope link 
       valid_lft forever preferred_lft forever
```

```
[root@c151e2c627bc /]# ip link show
1: lo: <LOOPBACK,UP,LOWER_UP> mtu 65536 qdisc noqueue state UNKNOWN mode DEFAULT 
    link/loopback 00:00:00:00:00:00 brd 00:00:00:00:00:00
9929: cali0@if9930: <BROADCAST,MULTICAST,UP,LOWER_UP> mtu 1500 qdisc pfifo_fast state UP mode DEFAULT qlen 1000
    link/ether ee:ee:ee:ee:ee:ee brd ff:ff:ff:ff:ff:ff link-netnsid 0
9931: eth1@if9932: <BROADCAST,MULTICAST,UP,LOWER_UP> mtu 1500 qdisc noqueue state UP mode DEFAULT 
    link/ether 02:42:ac:12:00:03 brd ff:ff:ff:ff:ff:ff link-netnsid 0
```

**Comment by depay** [comment]
IIRC, tcpdump catches packets before iptables..i'm  doulting those pings maybe dropped before that chain..

**Comment by fasaxc** [comment]
Hmm, the routing inside the container looks wrong to me and there's an additional eth1 device in there.  Are you trying to network this container with Calico and another plugin (or docker networking) as well?

**Comment by depay** [comment]
no, i did not...just `docker network create --driver calico --subnet=192.168.1.0/24 net1` then `docker run --net net1 xxxxxxx`..btw, my docker version is 1.9.1.

Besides the `eth1`(172.18.0.3/16), a bridge named `gwbridge`(172.18.0.0/16) exists on host.

**Comment by robbrockbank** [comment]
When creating the network you didn't specify the `--ipam-driver calico` option.  Was this a deliberate choice? When you don't specify the Calico IPAM our plugin reverts to using default Docker IPAM, and in addition we let Docker set up the container interfaces to connect the container the Docker bridge.  This is useful for testing where you want to use port forwarding in the case you have not set up your BGP peering to allow external traffic - but is not the recommended solution as you don't get full Calico isolation in certain circumstances.

I don't think this explains what you are seeing - but let me have a bit of a think about that ...  In the meantime have you tried creating your network with the `--ipam-driver calico` option?

**Comment by depay** [comment]
@robbrockbank , thanks for ur explaination. I've tried using `--ipam-driver calico` before, but it didn't work..

```
calicoctl pool add 192.168.128.0/24
docker network create --driver calico --ipam-driver calico  test_net_128
docker run -it --net test_net_128 <my_net_test_image>
```

```
[root@7b91fed17367 /]# ip addr show
1: lo: <LOOPBACK,UP,LOWER_UP> mtu 65536 qdisc noqueue state UNKNOWN 
    link/loopback 00:00:00:00:00:00 brd 00:00:00:00:00:00
    inet 127.0.0.1/8 scope host lo
       valid_lft forever preferred_lft forever
    inet6 ::1/128 scope host 
       valid_lft forever preferred_lft forever
19: cali0@if20: <BROADCAST,MULTICAST,UP,LOWER_UP> mtu 1500 qdisc pfifo_fast state UP qlen 1000
    link/ether ee:ee:ee:ee:ee:ee brd ff:ff:ff:ff:ff:ff link-netnsid 0
    inet 192.168.128.71/32 scope global cali0
       valid_lft forever preferred_lft forever
    inet6 fe80::ecee:eeff:feee:eeee/64 scope link 
       valid_lft forever preferred_lft forever
```

```
[root@7b91fed17367 /]# ip route show
default via 10.15.230.5 dev cali0 
10.15.230.5 dev cali0  scope link 
```

```
[root@7b91fed17367 /]# ip link show
1: lo: <LOOPBACK,UP,LOWER_UP> mtu 65536 qdisc noqueue state UNKNOWN mode DEFAULT 
    link/loopback 00:00:00:00:00:00 brd 00:00:00:00:00:00
19: cali0@if20: <BROADCAST,MULTICAST,UP,LOWER_UP> mtu 1500 qdisc pfifo_fast state UP mode DEFAULT qlen 1000
    link/ether ee:ee:ee:ee:ee:ee brd ff:ff:ff:ff:ff:ff link-netnsid 0
```

and i ping from container to host, and tcpdump

```
# tcpdump -n -i calic11b85b9d45
tcpdump: WARNING: calic11b85b9d45: no IPv4 address assigned
tcpdump: verbose output suppressed, use -v or -vv for full protocol decode
listening on calic11b85b9d45, link-type EN10MB (Ethernet), capture size 65535 bytes
10:33:07.348394 ARP, Request who-has 10.15.230.5 tell 192.168.128.71, length 28
10:33:08.350399 ARP, Request who-has 10.15.230.5 tell 192.168.128.71, length 28
10:33:10.347586 ARP, Request who-has 10.15.230.5 tell 192.168.128.71, length 28
10:33:11.350397 ARP, Request who-has 10.15.230.5 tell 192.168.128.71, length 28
...
```

macs on container is

```
[root@7b91fed17367 /]# arp -v
Address                  HWtype  HWaddress           Flags Mask            Iface
gateway                          (incomplete)                              cali0
Entries: 1      Skipped: 0      Found: 1
```

macs on host is

```
# arp -v
Address                  HWtype  HWaddress           Flags Mask            Iface
192.168.128.71           ether   ee:ee:ee:ee:ee:ee   CM                    calic11b85b9d45
10.15.230.4              ether   fa:16:3e:b6:7e:6f   C                     eth0
10.15.230.7              ether   fa:16:3e:3d:c8:33   C                     eth0
10.15.230.6              ether   fa:16:3e:db:35:7a   C                     eth0
gateway                  ether   3c:8c:40:5d:30:cb   C                     eth0
10.15.230.10             ether   fa:16:3e:e8:8a:21   C                     eth0
Entries: 6      Skipped: 0      Found: 6
```

**Comment by depay** [comment]
sorry, some body make `net.ipv4.conf.all.arp_ignore = 0` on my host... :sob:

**Comment by fasaxc** [comment]
Sounds like you've found the issue.
