### ISSUE TITLE
Calico IPIP - broken comunication between subnets

### ISSUE THREAD

**Issue by r0bj** [projectcalico/calico-containers#1233]
My environment:
OS: ubuntu 14.04
kernel: 4.4.0-45-generic
docker: 1.12.1
calicoctl: 0.22.0
calico-cni: 1.4.2
kubernetes: 1.4.3

I have two hosts in different subnets:
```
- 10.8.32.18/24 (k8s-worker-s3)
- 10.8.42.46/24 (k8s-worker-s4)
```

```
# calicoctl pool show
+---------------+-------------------+
|   IPv4 CIDR   |      Options      |
+---------------+-------------------+
| 10.200.0.0/16 | ipip,nat-outgoing |
+---------------+-------------------+
```

```
# calicoctl status
calico-node container is running. Status: Up 26 minutes
Running felix version 1.4.0

IPv4 BGP status
IP: 10.8.32.18    AS Number: 64511 (inherited)
+--------------+-------------------+-------+----------+-------------+
| Peer address |     Peer type     | State |  Since   |     Info    |
+--------------+-------------------+-------+----------+-------------+
|  10.8.42.46  | node-to-node mesh |   up  | 21:36:54 | Established |
+--------------+-------------------+-------+----------+-------------+
```
interfaces on on first host `10.8.32.18 k8s-worker-s3`:
```
2: eth0: <BROADCAST,MULTICAST,UP,LOWER_UP> mtu 1500 qdisc mq state UP group default qlen 1000
    link/ether 0c:c4:7a:0a:e3:96 brd ff:ff:ff:ff:ff:ff
    inet 10.8.32.18/24 brd 10.8.32.255 scope global eth0
       valid_lft forever preferred_lft forever
    inet6 fe80::ec4:7aff:fe0a:e396/64 scope link
       valid_lft forever preferred_lft forever
183: tunl0@NONE: <NOARP,UP,LOWER_UP> mtu 1440 qdisc noqueue state UNKNOWN group default qlen 1
    link/ipip 0.0.0.0 brd 0.0.0.0
    inet 10.200.122.0/32 scope global tunl0
       valid_lft forever preferred_lft forever
184: cali1d1b409d220@eth2: <BROADCAST,MULTICAST,UP,LOWER_UP,M-DOWN> mtu 1500 qdisc noqueue state UP group default
    link/ether 16:f3:04:27:8c:63 brd ff:ff:ff:ff:ff:ff
    inet6 fe80::14f3:4ff:fe27:8c63/64 scope link
       valid_lft forever preferred_lft forever
```
routing table on first host `10.8.32.18 k8s-worker-s3`:
```
# ip r
default via 10.8.32.1 dev eth0
10.8.32.0/24 dev eth0  proto kernel  scope link  src 10.8.32.18
10.200.85.64/26 via 10.8.42.46 dev tunl0  proto bird onlink
blackhole 10.200.122.0/26  proto bird
10.200.197.160 via 10.8.42.46 dev tunl0  proto bird onlink
10.200.231.121 dev cali1d1b409d220  scope link
172.17.0.0/16 dev docker0  proto kernel  scope link  src 172.17.0.1
```

interfaces on second host `10.8.42.46 k8s-worker-s4`:
```
2: eth0: <BROADCAST,MULTICAST,UP,LOWER_UP> mtu 1500 qdisc mq state UP group default qlen 1000
    link/ether 0c:c4:7a:07:21:08 brd ff:ff:ff:ff:ff:ff
    inet 10.8.42.46/24 brd 10.8.42.255 scope global eth0
       valid_lft forever preferred_lft forever
    inet6 fe80::ec4:7aff:fe07:2108/64 scope link
       valid_lft forever preferred_lft forever
278: tunl0@NONE: <NOARP,UP,LOWER_UP> mtu 1440 qdisc noqueue state UNKNOWN group default qlen 1
    link/ipip 0.0.0.0 brd 0.0.0.0
    inet 10.200.85.64/32 scope global tunl0
       valid_lft forever preferred_lft forever
279: cali7970da59d00@eth2: <BROADCAST,MULTICAST,UP,LOWER_UP,M-DOWN> mtu 1500 qdisc noqueue state UP group default
    link/ether 1a:bf:92:62:eb:a2 brd ff:ff:ff:ff:ff:ff
    inet6 fe80::18bf:92ff:fe62:eba2/64 scope link
       valid_lft forever preferred_lft forever
```
routing table on second host `10.8.42.46 k8s-worker-s4`:
```
# ip r
default via 10.8.42.1 dev eth0
10.8.42.0/24 dev eth0  proto kernel  scope link  src 10.8.42.46
blackhole 10.200.85.64/26  proto bird
10.200.122.0/26 via 10.8.32.18 dev tunl0  proto bird onlink
10.200.197.160 dev cali7970da59d00  scope link
10.200.231.121 via 10.8.32.18 dev tunl0  proto bird onlink
172.17.0.0/16 dev docker0  proto kernel  scope link  src 172.17.0.1
```

There are two containers, one on each host:
```
# kubectl get pods -o wide
NAME                     READY     STATUS    RESTARTS   AGE       IP               NODE
nginx-2612444508-j6z3a   1/1       Running   0          59m       10.200.231.121   k8s-worker-s3
nginx-2612444508-l2wfw   1/1       Running   0          59m       10.200.197.160   k8s-worker-s4
```

So from first host `10.8.32.18 k8s-worker-s3` I want ping container `10.200.197.160` on second host:
```
root@k8s-worker-s3 ~# ping 10.200.197.160
```

tcpdump on source host `10.8.32.18 k8s-worker-s3`:
```
root@k8s-worker-s3 22:11:21 ~# tcpdump -pni any host 10.200.197.160
tcpdump: verbose output suppressed, use -v or -vv for full protocol decode
listening on any, link-type LINUX_SLL (Linux cooked), capture size 65535 bytes
22:11:33.377155 IP 10.200.122.0 > 10.200.197.160: ICMP echo request, id 5109, seq 1, length 64
22:11:34.383723 IP 10.200.122.0 > 10.200.197.160: ICMP echo request, id 5109, seq 2, length 64
22:11:35.391796 IP 10.200.122.0 > 10.200.197.160: ICMP echo request, id 5109, seq 3, length 64
```
tcpdump on destination host `10.8.42.46 k8s-worker-s4`:
```
root@k8s-worker-s4 ~# tcpdump -pni any host 10.200.197.160
tcpdump: verbose output suppressed, use -v or -vv for full protocol decode
listening on any, link-type LINUX_SLL (Linux cooked), capture size 65535 bytes
22:10:27.353743 IP 10.200.122.0 > 10.200.197.160: ICMP echo request, id 3954, seq 2, length 64
22:10:28.353798 IP 10.200.122.0 > 10.200.197.160: ICMP echo request, id 3954, seq 3, length 64
22:10:29.353720 IP 10.200.122.0 > 10.200.197.160: ICMP echo request, id 3954, seq 4, length 64
```

So packets reach destination host but for some reason do not come back to source host.
Routing on destination host for source address leads into tunnel:
```
root@k8s-worker-s4 ~# ip r get 10.200.122.0
10.200.122.0 via 10.8.32.18 dev tunl0  src 10.200.85.64
    cache
```

In other direction behaviour is the same, packets reach destination host but do not come back.

`calicoctl diags` from first host `10.8.32.18 k8s-worker-s3`:
https://transfer.sh/F0nAR/diags-281016-221531.tar.gz
`calicoctl diags` from second host `10.8.42.46 k8s-worker-s4`:
https://transfer.sh/eWeCI/diags-281016-221611.tar.gz

Is there anything I can do to make it work?

**Comment by r0bj** [comment]
There was no active endpoints in calico, I had to redeploy containers.

**Comment by nemmeviu** [comment]
+1
